{
  "@context": "https://obligationfirst.org/v1/context.jsonld",
  "@type": "of:Determination",
  "@id": "https://obligationfirst.org/v1/examples/colorado-sb24-205/determination/stay-order",
  "issued_date": "2025-12-15",
  "issuedBy": "https://obligationfirst.org/v1/examples/colorado-sb24-205/authority/federal-district-court",
  "jurisdiction": {
    "@type": "of:Jurisdiction",
    "territorial_scope": [
      "us"
    ]
  },
  "decides": [
    "https://obligationfirst.org/v1/examples/colorado-sb24-205/allegation/enforcement-challenge"
  ],
  "disposition": "confirmed",
  "anchors": [
    "https://obligationfirst.org/v1/examples/colorado-sb24-205/obligation/violation-reparation"
  ],
  "notes": "The Determination does NOT void the underlying Requirement in §6-1-1703; the Requirement remains in the schema as enacted. What the Determination affects is the enforcement_authority's capacity to act on the Reparation until rulemaking completes. Issued_date is illustrative; this is a teaching construct with no adopter counterpart."
}
