{
  "@context": "https://obligationfirst.org/v1/",
  "@type": "of:Determination",
  "@id": "https://obligationfirst.org/v1/examples/colorado-sb24-205/determination/ag-non-enforcement-statement",
  "issued_date": "2025-11-30",
  "issuedBy": "https://obligationfirst.org/v1/examples/colorado-sb24-205/authority/attorney-general",
  "jurisdiction": {
    "@type": "gist:Jurisdiction",
    "ref": "us-co"
  },
  "decides": [],
  "disposition": "issued",
  "anchors": [
    "https://obligationfirst.org/v1/examples/colorado-sb24-205/obligation/violation-reparation"
  ],
  "notes": "Administrative posture statement, not an adjudicative ruling. AG stated to the federal court that he does not intend to enforce SB 24-205 or any replacement law until rulemaking is complete; has not yet initiated formal rulemaking. Disposition 'issued' reflects that this Determination is a published act of the AG, not a ruling on Allegations. Decides is empty by design."
}
